file_name,bill_number,product_name,requested_weight,available_weight,shortfall
ขาย 4-7-2569 แบบละเอียด.xls,A2007621,ทองแดงใหญ่,208,56.3,151.7
ขาย 4-7-2569 แบบละเอียด.xls,A2007621,ทองแดงเล็ก,98.2,17.7,80.5
ขาย 4-7-2569 แบบละเอียด.xls,A2007621,หม้อน้ำทองแดง,347.2,1.2,346
ขาย 4-7-2569 แบบละเอียด.xls,A2007621,ทองแดงท่อ Candy,22.6,0,22.6
ขาย 4-7-2569 แบบละเอียด.xls,A2007621,ทองเหลืองเนื้อแดง,82,0.8,81.2
ขาย 4-7-2569 แบบละเอียด.xls,A2007622,ทองแดงชุบ,4.2,2.3,1.9
ขาย 4-7-2569 แบบละเอียด.xls,A2007622,ทองเหลืองหนา,280.6,39,241.6
ขาย 4-7-2569 แบบละเอียด.xls,A2007622,หม้อน้ำทองเหลือง,86.4,0,86.4
ขาย 6-7-2569 แบบละเอียด.xls,A2007625,เหล็กหล่อเล็ก,12235,1354,10881